Nombre,Id,Descripcion,Direccion,Tipo,Telefono,Propietario,Precio,Habitaciones,Banos,Terreno,Educacion,Familiares,Avenidas,Estacion,Comercio,Tranquilo,Presupuesto,Vecinos,Verde,Casa,Apartamento,Unidad,Decorar,Garaje,Mascota,Ascensor,Piso
Apto Unidad Los Campos,0,"Apartamento de 2 pisos en unidad residencial sin ascensor. Se encuentra cercano a la estación del mio Meléndez y a las avenidas principales del sector, por lo cual es muy central para universitarios. Tiene 4 habitaciones y permite tener mascota. Valor de arriendo: $900.000",Meléndez,Apartamento,313456899,Juliana Sandoval,900.000,4,2,200,5,2,5,5,3,3,4,2,3,0,5,5,3,1,4,0,0
Casa La Martina,1,"Hermosa casa de un solo piso con amplias zonas verdes. Permite tener mascotas y decorar al gusto de los inquilinos. Cuenta con 4 habitaciones. Se encuentra en un sector alejado, sin cercanía a ninguna avenida, por lo mismo es muy tranquilo y silencioso. Valor de arriendo: $1'200.000",Calicanto,Casa condominio,321787370,Ivan Torres,1'200.000,4,3,400,0,0,0,2,2,5,2,1,5,5,0,2,5,4,5,5,5
Casa Royal en unidad residencial,2,"Casa en unidad residencial. Cuenta con 3 pisos, 4 habitaciones y garaje. Esta ubicada en una zona con mucho movimiento por los muchos locales comerciales, mercados y restaurantes; los vecinos son muy amables. Dejan tener mascotas y no permiten decorar. Valor de arriendo: $1’350.000",Valle del Lili,Casa condominio,312487955,Camila Mendoza,1'350.000,4,2,380,3,3,3,3,4,2,2,4,3,4,0,5,2,4,5,2,2
Casa Los Olivos,3,"Casa de un solo piso con garaje. Tiene 3 habitaciones. Se encuentra en un barrio muy comercial, con restaurantes, bares y tiendas, Además está cercana a tus familiares y amigos. Permiten decorar y tener mascota. Retirada a principales avenidas, universidades y estaciones del mío. Valor de arriendo: $830.000",Vallegrande,Casa,316507415,Maria Calle,830.000,3,2,300,2,4,2,2,4,1,3,2,2,5,0,0,5,5,5,0,3
Apartamento Santa Mónica,4,"Apartamento de 2 pisos y 2 habitaciones. Esta ubicado en zona cercana a las principales universidades. Alejada a amigos y familiares, pero próxima a avenidas y estaciones del Mio. Es un sector comercial y tranquilo con unos vecinos no tan amigables. La unidad no cuenta con zonas verdes ni con ascensor, no tiene garaje o parqueadero, no permite decorar ni tener mascota. Valor de arriendo: $500.000",Ciudad Cordoba,Apartamento,314766878,Julian Ortiz,500.000,2,1,150,5,2,4,4,3,4,4,1,2,0,5,5,0,0,2,0,0
Casa unidad Ciudadela,5,"Casa en condominio. Cuenta con 3 pisos y 5 habitaciones. Esta alejado a las universidades de la ciudad, pero esta cercano a familiares y a las avenidas; no está próximo a estaciones del Mio. Cuenta con mucho comercio y movimiento en la zona por lo cual puede ser algo intranquilo y ruidoso. Los vecinos son muy cordiales y amigables. Tiene amplias zonas verdes y parqueadero. No dejan decorar ni tener mascotas y no posee ascensor.Valor de arriendo: $600.000",San Antonio,Casa condominio,312434566,Claudia Gonzalez,600.000,5,3,380,0,4,3,2,5,1,5,5,4,5,0,5,2,5,5,0,0
Apartamento Vista Hermosa,6,"Apartamento de un piso y 3 habitaciones. Esta próximo a las universidades de la ciudad, a las avenidas y estaciones del Mio, pero se encuentra apartado de familiares y amigos. La zona cuenta con muy buen comercio, zona de restaurantes y mercado y es muy tranquila y silenciosa. Los vecinos son muy amables y cordiales. La unidad tiene buenas zonas verdes y zona de parqueadero. Permiten decorar y tener mascota. Valor de arriendo: $1'400.000",Caney,Apartamento,317890955,Valentina Arias,1'400.000,3,2,120,3,1,5,5,5,5,1,3,5,0,5,3,4,3,4,0,4
Casa Cristales,7,"Casa de 4 pisos, 5 habitaciones, 4 baños y terreno de 420 m2  Se encuentra cercano al sector universitario y próximo a familiares y amigos. Alejado a las avenidas principales y estaciones del Mio. Pero tiene tiendas, boutiques, restaurantes y supermercados cerca. Barrio tranquilo y silencioso con vecinos respetuosos y amables. Tiene garaje y ascensor. No cuenta con zona verde, permiten tener mascotas, pero no permiten decorar. Valor de arriendo: $2'000.000",Pance,Casa,312434555,Stefany Garcia,2'000.000,5,4,420,4,3,2,2,3,3,2,4,1,5,0,0,2,4,5,4,0